{
  "$schema": "http://json-schema.org/draft-04/schema#",
  "title": "Given any tax year 2024-25 and after",
  "description": "Retrieve Pension Charges",
  "type": "object",
  "properties": {
    "submittedOn": {
      "type": "string",
      "format": "YYYY-MM-DDThh:mm:ss.sssZ",
      "description": "An ISO-8601 compliant date-time representing when pension charges were submitted.",
      "example": "2021-04-04T01:01:01.000Z"
    },
    "pensionSchemeOverseasTransfers": {
      "type": "object",
      "description": "Object holding the transfer of overseas pension to another pension scheme.",
      "properties": {
        "overseasSchemeProvider": {
          "description": "Details of overseas pension provider.",
          "type": "array",
          "items": {
            "title": "item",
            "type": "object",
            "properties": {
              "providerName": {
                "description": "The name of the pension provider",
                "type": "string",
                "example": "Overseas Pensions Plc"
              },
              "providerAddress": {
                "description": "The address of the pension provider.",
                "type": "string",
                "example": "111 Main Street, Any Town, Any City"
              },
              "providerCountryCode": {
                "description": "A three-letter code that represents a country name. The value must be a ISO 3166-1 alpha-3 code.",
                "type": "string",
                "example": "CYM"
              },
              "qualifyingRecognisedOverseasPensionScheme": {
                "type": "array",
                "items": {
                  "description": "A list of one or more qualifying overseas pension scheme reference numbers for overseas pensions contributions.",
                  "type": "string",
                  "example": "Q123456"
                }
              },
              "pensionSchemeTaxReference": {
                "type": "array",
                "items": {
                  "description": "A list of one or more unique references provided by HM Revenue and Customs (HMRC) when the scheme has been registered for tax relief and exemptions. It is 10 characters made up of 8 numbers followed by 2 letters.",
                  "type": "string",
                  "example": "00123456RA"
                }
              }
            },
            "required": [
              "providerName",
              "providerAddress",
              "providerCountryCode"
            ]
          }
        },
        "transferCharge": {
          "description": "The amount the pension provider charges to transfer the pension. The value must be between 0 and 99999999999.99 up to 2 decimal places.",
          "type": "number",
          "example": "1999.99"
        },
        "transferChargeTaxPaid": {
          "description": "The amount of tax paid on the transfer charge. The value must be between 0 and 99999999999.99 up to 2 decimal places.",
          "type": "number",
          "example": "1999.99"
        }
      },
      "required": [
        "overseasSchemeProvider",
        "transferCharge",
        "transferChargeTaxPaid"
      ]
    },
    "pensionSchemeUnauthorisedPayments": {
      "type": "object",
      "description": "Object holding tax on unauthorised payment.",
      "properties": {
        "pensionSchemeTaxReference": {
          "type": "array",
          "items": {
            "description": "A list of one or more unique references provided by HM Revenue and Customs (HMRC) when the scheme has been registered for tax relief and exemptions. It is 10 characters made up of 8 numbers followed by 2 letters.",
            "type": "string",
            "example": "00123456RA"
          }
        },
        "surcharge": {
          "type": "object",
          "description": "The unauthorised payments surcharge.",
          "properties": {
            "amount": {
              "description": "The amount of the unauthorised payment. The value must be between 0 and 99999999999.99 up to 2 decimal places.",
              "type": "number",
              "example": "1999.99"
            },
            "foreignTaxPaid": {
              "description": "The amount of foreign tax paid in pounds sterling. The value must be between 0 and 99999999999.99 up to 2 decimal places.",
              "type": "number",
              "example": "1999.99"
            }
          },
          "required": [
            "amount",
            "foreignTaxPaid"
          ]
        },
        "noSurcharge": {
          "type": "object",
          "description": "Object holding unauthorised payments for no surcharge.",
          "properties": {
            "amount": {
              "description": "The amount of the unauthorised payment. The value must be between 0 and 99999999999.99 up to 2 decimal places.",
              "type": "number",
              "example": "1999.99"
            },
            "foreignTaxPaid": {
              "description": "The amount of foreign tax paid in pounds sterling. The value must be between 0 and 99999999999.99 up to 2 decimal places.",
              "type": "number",
              "example": "1999.99"
            }
          },
          "required": [
            "amount",
            "foreignTaxPaid"
          ]
        }
      }
    },
    "pensionContributions": {
      "type": "object",
      "description": "Object holding payments paid into a pension",
      "properties": {
        "pensionSchemeTaxReference": {
          "type": "array",
          "items": {
            "description": "A list of one or more unique references provided by HM Revenue and Customs (HMRC) when the scheme has been registered for tax relief and exemptions. It is 10 characters made up of 8 numbers followed by 2 letters.",
            "type": "string",
            "example": "00123456RA"
          }
        },
        "inExcessOfTheAnnualAllowance": {
          "description": "The amount of the in excess of the annual allowance. The value must be between 0 and 99999999999.99 up to 2 decimal places.",
          "type": "number",
          "example": "1999.99"
        },
        "annualAllowanceTaxPaid": {
          "description": "The amount of tax paid on annual allowance. The value must be between 0 and 99999999999.99 up to 2 decimal places.",
          "type": "number",
          "example": "1999.99"
        },
        "isAnnualAllowanceReduced": {
          "description": "A boolean indicating whether annual allowance has been reduced. The value must be true or false. If isAnnualAllowanceReduced is true then either taperedAnnualAllowance or moneyPurchasedAllowance must be true as well.",
          "type": "boolean",
          "example": "false"
        },
        "taperedAnnualAllowance": {
          "description": "A boolean indicating whether tapered annual allowance is lower than the standard annual allowance. The value must be true or false.",
          "type": "boolean",
          "example": "true"
        },
        "moneyPurchasedAllowance": {
          "description": "A boolean indicating whether the person has paid the maximum amount allowed for their reduced allowance, based on Money Purchase Annual Allowance (MPAA). The value must be true or false. For example: false",
          "type": "boolean",
          "example": "false"
        }
      },
      "required": [
        "pensionSchemeTaxReference",
        "inExcessOfTheAnnualAllowance",
        "annualAllowanceTaxPaid"
      ]
    },
    "overseasPensionContributions": {
      "type": "object",
      "description": "Object holding the contributions paid into overseas pension.",
      "properties": {
        "overseasSchemeProvider": {
          "description": "Details of overseas pension provider.",
          "type": "array",
          "items": {
            "title": "item",
            "type": "object",
            "properties": {
              "providerName": {
                "description": "The name of the pension provider",
                "type": "string",
                "example": "Overseas Pensions Plc"
              },
              "providerAddress": {
                "description": "The address of the pension provider.",
                "type": "string",
                "example": "111 Main Street, Any Town, Any City"
              },
              "providerCountryCode": {
                "description": "A three-letter code that represents a country name. The value must be a ISO 3166-1 alpha-3 code.",
                "type": "string",
                "example": "CYM"
              },
              "qualifyingRecognisedOverseasPensionScheme": {
                "type": "array",
                "items": {
                  "description": "A list of one or more qualifying overseas pension scheme reference numbers for overseas pensions contributions.",
                  "type": "string",
                  "example": "Q123456"
                }
              },
              "pensionSchemeTaxReference": {
                "type": "array",
                "items": {
                  "description": "A list of one or more unique references provided by HM Revenue and Customs (HMRC) when the scheme has been registered for tax relief and exemptions. It is 10 characters made up of 8 numbers followed by 2 letters.",
                  "type": "string",
                  "example": "00123456RA"
                }
              }
            },
            "required": [
              "providerName",
              "providerAddress",
              "providerCountryCode"
            ]
          }
        },
        "shortServiceRefund": {
          "description": "The amount of short service refund for overseas pension contributions. The value must be between 0 and 99999999999.99 up to 2 decimal places.",
          "type": "number",
          "example": "1999.99"
        },
        "shortServiceRefundTaxPaid": {
          "description": "The amount of tax paid on short service refund. The value must be between 0 and 99999999999.99 up to 2 decimal places.",
          "type": "number",
          "example": "1999.99"
        }
      },
      "required": [
        "overseasSchemeProvider",
        "shortServiceRefund",
        "shortServiceRefundTaxPaid"
      ]
    }
  },
  "additionalProperties": false
}
